Title,Author 1,Affiliation A1,Country A1,Gender A1,Author 2,Affiliation A2,Country A2,Gender A2,Author 3,Affiliation A3,Country A3,Gender A3,Author 4,Affiliation A4,Country A4,Gender A4,Author 5,Affiliation A5,Country A5,Gender A5,Abstract,Year,Type,Conference/workshop/... title,Volume,Special issue,Blog extract
Freigeistige Organisationen in Deutschland: Weltanschauliche Entwicklungen und strategische Spannungen nach der humanistischen Wende,Stefan Schröder,University of Bayreuth,Germany,M,.,.,.,.,.,.,.,.,.,.,.,.,.,.,.,.,"This study explores the historical evolution of free-thinking organizations in post-1945 Germany, especially after the humanist turn of the 1980s. It develops an organizational typology that uncovers evolving worldviews and strategic tensions within the free-thinking milieu and explores current patterns of perception in secularization theory.",2018,Book,"Religion and its others: Studies in Religion, Nonreligion and Secularity",.,.,.
Myth and Solidarity in the Modern World: An Introduction,Timothy Stacey,University of Ottawa,Canada,M,.,.,.,.,.,.,.,.,.,.,.,.,.,.,.,.,"The world is awash with myths and fake news. The gut consensus among university-educated, post-Enlightenment minds appears to be that we should do away with myths altogether. But what about the positive role that myths play in underwriting shared action? My book, Myth and Solidarity in the Modern World: Beyond Religious and Political Division, sheds light on this positive role and how groups are facilitating the inclusive sharing of myths in diverse spaces. The following is a short introduction to that book. ",2018,Blog,NSRN blog,.,.,"'Myth’ is a term widely used but rarely defined. It’s employed regularly among journalists and politicians as a euphemism for 'lies,’ such as in the New Yorker’s recent headline, “Mueller’s Indictment Ends Trump Myth of the Russia 'Hoax’.” Just as commonly, myth is used to denote not outright lies, but the basing of broader narratives in prominent, but not statistically significant, events. This usage is employed by social progressives and conservatives alike, such as the myth of the Muslim terrorist or the myth of white privilege. In these cases, the use of myth is associated with the rise of grassroots media. Yet another usage of myth regards religious narratives: in this case, it is the events themselves, rather than their statistical significance that is called into question. Here myth is cast as an age-old problem yet to be removed from the modern psyche. Ill-defined as they are, these usages share a common thread: myths are dangerous, sometimes pernicious things that go against key principles on which modernity is founded."
The 'Secular AA’ Movement,Zachary Munro,University of Waterloo,Canada,M,.,.,.,.,.,.,.,.,.,.,.,.,.,.,.,.,"In this blog post, Zachary Munro discusses the development of a non-religious recovery culture in Alcoholics Anonymous (AA), and how groups like Secular Organizations for Sobriety (SOS), and LifeRing Secular Recovery are renegotiating their relationships to AA’s origins in the evangelical “Oxford Group” of the 1930s. As this non-religious recovery culture grows, it continues to explore ways in which the Twelve Steps on the road from the “addicted-self” to the “recovering-self” might need neither God nor even “spiritual” discipline to work.",2018,Blog,NSRN blog,.,.,"The religious components of Alcoholics Anonymous (AA) and other Twelve-Step fellowships for addiction-recovery have long challenged the participation of secular individuals. The fellowship, which has a membership base of over two million, uses a spiritual program that emphasizes belief in a “higher power” and daily spiritual practice to achieve and sustain recovery. In recent years a growing secular movement has been occurring within AA that has prompted an increasing number of secular meeting groups to organize. This trend has seen significant growth since the early 2010s, supported largely through online networking websites such as AA Agnostica, AA Beyond Belief, and Secular AA. The growth and increasing organization of this community has facilitated a culture centered on the experience of being secular in AA and navigating its spiritual program of recovery."
Religious vs cultural? Some findings about the unexpected dichotomy,Atko Remmel,University of Tartu,Estonia,M,.,.,.,.,.,.,.,.,.,.,.,.,.,.,.,.,"When discussing their visits to the churches, a number of my nonreligious informants from Estonia have mentioned that their interest is not 'religious’, but 'cultural’. I have also noticed a similar tendency at conferences – while not directly opposing the two, some colleagues talk of religion and culture as separate entities. Both examples tell us quite a lot about how 'culture’ is perceived – in this context it’s actual meaning seems to be 'secular’ – or, at least, it has strong connotation with 'not religious’. Based on my findings from Estonian media and interviews with nonreligious informants, the paper explores the possibility of studying the essence of nonreligion via the mutual relationships of 'religion’, 'culture’ and 'nonreligion’. Particular attention is paid to the changes in the meanings of 'religious’ and 'nonreligious’ words and their connotations.",2018,Conference,"Worldviews in World View: Particularizing Secularism, Secularity and Nonreligion",.,.,.
Seeking Cultural Change in the Reproduction of Intolerance: Secularism, Islamism and 'others’ in Turkey’s experience of democratization,Metin Koca,European University Institute,Italy,M,.,.,.,.,.,.,.,.,.,.,.,.,.,.,.,.,"Despite long-term efforts to explain the universal and the regional patterns of democratization, little has been achieved in understanding the individual experience of societies with these patterns. A particular cultural element has been recognized in the democratization literature, but the focal point of this study of 'culture’ has not been change but persistence. With a methodology that brings together agency, time and social context, this study aims at grasping cultural change in, firstly what has been perceived on the field as a continuity (i.e. settled cultural processes), and secondly what has been consciously recognized as a process of change (i.e. unsettled cultural processes). Focusing on the interrelationship of these cultural processes, I problematize the polarization between secularism(s), Islamism(s) and their 'others’, which has arguably been the deepest ideological struggle behind the core questions of coexistence in the history of Turkey’s democratization. By analyzing a selection of conversational texts from three fields that signify a reproduction of intolerance—these fields are 'Alevis and funerals’, 'women and clothing’, and 'LGBT and show business’—I will argue that Turkey has recently faced some unprecedented questions of tolerance, which includes new approaches to the politics of recognition, difference and negative tolerance. In conclusion, the study will touch upon the ways to examine 'settled’ and 'unsettled’ cultural processes, the re-making of secularism in Turkey, and the differentiated meanings of the concept of tolerance in this period.",2018,Conference,"Worldviews in World View: Particularizing Secularism, Secularity and Nonreligion",.,.,.
Mediating 'Religious’ and 'Non-Religious’ Spaces: A Cultural Expression of a Japanese Religion in Postwar France,Masato Kato,SOAS University of London,England,M,.,.,.,.,.,.,.,.,.,.,.,.,.,.,.,.,"This paper will explore the roles that cultural representations can play in mediating the 'religious’ and 'non-religious’ spaces through the case of a Japanese religion operating in postwar France. Boundaries between religious and non-religious spaces are often contested and negotiated by relevant social actors and institutions, as evinced by recent scholarship on religions in the public sphere. Not much has been discussed so far, however, as to how representations and institutional activities associated with a certain culture can mediate the two spaces by translating the religious representations and messages into the cultural counterparts. To highlight this dynamic, this paper will highlight the case of a Japanese religion known as Tenrikyō as it operates in postwar France. Tenrikyō’s propagation in France is characterised by its two-tier yet legally separate institutional structure involving 'religious’ and 'cultural’ associations—an institutional demarcation necessitated by the French legal framework relating to the 1901 and 1905 laws. In the course of promoting cultural activities as a way to increase the visibility and legitimacy of the name Tenri in the French public, Tenrikyō has at times the reinterpretation process but is not a sufficient explanation for the radical used representations and activities associated with Japan in ways that allow messages and representations that are otherwise confined to religious spaces to go beyond the boundaries thereof. By exploring the case of Tenrikyō in France, this paper will consider the implications and limitations of using cultural resources to present a religious tradition in a non-religious space.",2018,Conference,"Worldviews in World View: Particularizing Secularism, Secularity and Nonreligion",.,.,.
Reinterpreting sacred experiences: Examining how exposure to global and historical diversity can transform an individual's meaning system,James Murphy,South Dakota State University,South Dakota,M,.,.,.,.,.,.,.,.,.,.,.,.,.,.,.,.,"Experiences that are deemed spiritual or sacred often play an important role in both creating and sustaining religious beliefs but the way that these experiences are subsequently interpreted by individuals who have left religious worldviews is underexplored. This paper presents a case study that explores how an individual who previously experienced many vivid and powerful spiritual experiences came to question the ontological nature of those experiences and eventually reject his previous beliefs about them. Doing so involved the transformation of a deeply held meaning system and a radical change in self-identity, from charismatic-evangelical Christian to secular Humanist. A key element of this transformative process was exposure to accounts of similar experiences from other faiths and competing explanatory worldviews, both historical and contemporary. This exposure to other worldviews was an important part of transformation of his worldview. It is suggested that other important factors included his academic training in scientific method and critical thinking, positive personal relationships with people from contrasting cultures, and both a strong commitment to truth and a confidence in his own judgement that were the result of his prior faith and experiences. The confluence of particular intellectual, social and cultural influences led to the transformation of his beliefs and this personal context is critical to understanding the changes he experienced. This case demonstrates the importance of idiosyncratic details in the formation and transformation of worldviews and helps illuminate the complex relationship between globalisation and secularization.",2018,Conference,"Worldviews in World View: Particularizing Secularism, Secularity and Nonreligion",.,.,.
The “Religious” and “Secular” Nature of Self-Spirituality: Insights from the Field,Galen Watts,Queen’s University,Canada,M,.,.,.,.,.,.,.,.,.,.,.,.,.,.,.,.,"In the last quarter century, a steadily increasing number of North Americans, when asked their religious affiliation, have self-identified as “spiritual but not religious” (SBNR). Paul Heelas (1996) has deemed the emerging religio-cultural form underpinning this moniker, “selfspirituality,” as it sacralizes the self. Upon completing semi-structured interviews with twenty Canadian millennials who self-identify as SBNR conducted between 2014-2015, I found the discourse of self-spirituality to be informed by four core ethics: the ethic of self-responsibility, the ethic of authenticity, the ethic of productivity and the ethic of self-awareness (Watts 2015). Drawing from ongoing ethnographic fieldwork conducted at three different sites in downtown Toronto—a Toastmaster’s meeting, a Twelve-Step group (Alcoholics Anonymous), and an evangelical church (C3)—I argue that the discourse of self-spirituality can be found, in strikingly similar forms, in each. In other words, despite the ostensible differences between these three organizations they, in fact, endorse quite similar conceptions of the self, as well as, respectively, preach a moral message of self-empowerment, which is tied to an expressive individualism. By presenting data derived from field notes and informal interviews, in tandem with formal documents produced by the organizations themselves, I aim to challenge the commonplace view that so-called religious spaces (i.e. evangelical churches), spiritual spaces (i.e. AA), and secular spaces (i.e. Toastmaster’s) are inherently different, as well as problematize the notion that emic categories such as “religious,” “not religious” and “spiritual but not religious” necessarily reflect vastly different conceptions of the self and the good life.",2018,Conference,"Worldviews in World View: Particularizing Secularism, Secularity and Nonreligion",.,.,.
Occupation, Generational Memory and 'Secular’ Self-Talk: the case of Generation Y Jewish-Israelis,Stacey Gutkowski,King’s College London,England,F,.,.,.,.,.,.,.,.,.,.,.,.,.,.,.,.,"This paper sheds light on one aspect of the complex process whereby post-Oslo modalities of Occupation have been absorbed into self-narratives of one Jewish-Israeli social group: young hilonim ('secular Jews’) who came of age in the 2000s. Through a close reading of three interviews with young hilonim from across the political spectrum, it highlights one important but hitherto unappreciated aspect of collective generational memory which has primed their understanding of themselves as 'reasonable people.’ Using new fieldwork and survey data, it hypothesizes two things: first, that young hilonim have been susceptible to Likud-led governments’ strategies of legitimizing Occupation through what Van Leeuwen calls discursive 'rationalization;’ second, that hiloni habitus 'priming’ at a formative age has played some as-yet unappreciated role in this. The paper focuses on this 'priming’ process during the 2000s and 2010s. It discusses the case of hilonim in light of the comparative literature on 'secular Judaism,’ proposing a new theoretical approach for its study.",2018,Conference,"Worldviews in World View: Particularizing Secularism, Secularity and Nonreligion",.,.,.
Religiosity, Spirituality, and Secularity among Nones in the United States and Canada,Joel Thiessen,Ambrose University,Canada,M,Sarah Wilkins-Laflamme,University of Waterloo,Canada,F,.,.,.,.,.,.,.,.,.,.,.,.,"A diversity of (non)religious and spiritual beliefs as well as behaviour exist among those who do not belong to a religious group or tradition. These different approaches and meanings to being a religious none are influenced by a range of variables including one’s pathway into saying they have no religion (e.g. irreligious socialization versus disaffiliation), as well as the social environment that one lives in (e.g. in a high versus low religious setting). Drawing on extensive survey data in the United States and Canada, as well as interview data with thirty religious nones in Calgary, Canada, we offer a sociological exploration into the heterogeneity among religious nones in North America. We focus on a continuum of five types of nones, based on the dimensions of belief and behaviour: involved seculars, inactive non-believers, inactive believers, spiritual but not religious, and church involved believers. In doing so, we examine the diversity of relationships that religious nones’ have or do not have with organized religion, personalized or group spiritualties, non-religion and non-belief, as well as organized secular communities. We give attention to how and why these respective groups have grown or declined over time, as well as where and why they are strongly or weakly represented (nationally and regionally).",2018,Conference,"Worldviews in World View: Particularizing Secularism, Secularity and Nonreligion",.,.,.
Self-Reported Reasons for Nonbelief in the Existence of God(s),Nick Stauner,Case Western Reserve University,Ohio,M,.,.,.,.,.,.,.,.,.,.,.,.,.,.,.,.,"Although many studies have examined predictors of belief and nonbelief in the existence of god(s), and many theories have surmised implicit reasons for individual differences in theistic beliefs, people’s subjective, explicit reasons for belief or nonbelief have different content. We studied these reasons in large surveys of U.S. adults (undergraduates and Internet-based samples). We examined reasons for nonbelief and belief: intellectual, relational, emotional (positive and negative), intuitive, experiential, socialization-based, and prior experiences with religion. Intellectual reasons predominated among nonbelievers; however, nonbelievers endorsed all reasons somewhat. These results contrasted with reasons for theistic belief, which distributed more equally across categories and averaged high levels of endorsement. Many reasons for nonbelief correlated with more ultimate meaning struggle and search for meaning, but only relational and agnostic reasons correlated with presence of meaning. These results highlight the diversity and importance of self-reported reasons behind people’s beliefs about the existence of God. Additional planned analyses will explore the potential for differences among self-described atheists, agnostics, the spiritual but not religious, and others who report no religious affiliation. No specific differences are anticipated, but any that result will be tested for replicability across multiple samples. This research will seek to explore the implications of nonreligious identities beyond their overt meanings regarding nonbelief in god(s). If reasons for nonbelief differ as well, this would lend further importance to these group identities, whereas null results would call their distinctiveness into question.",2018,Conference,"Worldviews in World View: Particularizing Secularism, Secularity and Nonreligion",.,.,.
Social and psychological aspects of collective spiritual therapies,Danijela Jerotijević,Comenius University,Slovakia,F,.,.,.,.,.,.,.,.,.,.,.,.,.,.,.,.,"The focus of this presentation is collective spiritual activities among urban population in Slovakia. They are popular among part of population that might be characterized as „spiritual but not religious“ (Willard, Norenzayan 2017) – people who are not affiliated to traditional (Christian) church, and even have negative opinion about it, but who seek for different kind of spiritual experiences. As Willard and Norenzayan pointed out, „spiritual but not religious“ has „an experiential relationship to the supernatural, and see themselves more connected to the universe as a whole“. Although collective therapies are quite popular at the moment, scholars only partly focus on them. These therapies contain elements of rituals, dance, sharing narratives and personal experiences, and may be charged with different kind of emotions. Here, I will present data from my field (qualitative) research and, combining classical theories of ritual (Durkheim, Malinowski) with psychological theories, I will analyze 1) motives for searching for this kind of experience, 2) try to explain what function they may have and why is group important in this context and, 3) what is the role of emotions in this context. I will also focus on methodological issue and restrictions of qualitaive methods.",2018,Conference,"Worldviews in World View: Particularizing Secularism, Secularity and Nonreligion",.,.,.
Eco-spirituality promotes environmentalism similarly in atheists and religious individuals,Adam Baimel,University of British Columbia,Canada,M,Catherine Li,University of British Columbia,Canada,F,Ara Norenzayan,University of British Columbia,Canada,M,.,.,.,.,.,.,.,.,"Atheists may denounce belief in and the importance of god(s) in their lives, but this does not necessarily suggest that they are completely free from other forms of supernatural beliefs that have direct consequences on their attitudes and behaviours. In this study, 786 Americans and 900 Canadian students completed a survey that assessed the extent of their eco-spiritual beliefs. (e.g., belief in 'gaia’ and their tendencies to anthropomorphize the natural world), a diverse set of attitudinal measures regarding climate change related issues, and a set of novel measures assessing sacred value orientations to protecting the environment. We find that although individuals who do not believe in god(s) do score lower on supernatural eco-spiritual beliefs than believers individuals, they do not reject these beliefs to the same extent as they do belief in god(s). And importantly, these types of beliefs have similar downstream consequences in both groups in predicting attitudinal concern for, moralization of, pro-environmental behaviours (including actual green charity donations) and sacred value orientations towards the issue of protecting the natural world. This work provides an important case study in understanding how the psychology and behaviours of self-professed nonbelievers can still be influenced by supernatural beliefs. ",2018,Conference,"Worldviews in World View: Particularizing Secularism, Secularity and Nonreligion",.,.,.
Non-Religion, Secularism and the South African Socio-Religious Context: South African Constitutionality in Dialogue with Talal Asad and Charles Taylor,Patrick B. S. Pillay,University of KwaZulu-Natal,South Africa,M,.,.,.,.,.,.,.,.,.,.,.,.,.,.,.,.,"The relative infancy of South Africa as a constitutional state based on the rule of law, has brought issues of secularism and the relationship between religion and State into sharp focus. In a socio-historical context in which religious normativity and the privileging of religion have gone largely uncontested, it is increasingly evident that the previously suppressed voices of the non-religious is enjoying recognition, within a Post-1994 constitutional framework which strikes a delicate balance between the separation of religion from matters of State, on the one hand, and the accommodation of religion in the social life of the country on the other. In dialogue, primarily, with the bodies of works of Tala Asad and Charles Taylor, particularly Formations of the Secular and The Secular Age, respectively, this paper aims to explore the socio-legal and constitutional standing of South Africans who choose not to ascribe to any faith-based religious position. By contrasting the country’s jurisprudence legacy under Apartheid, against the development of specific case law within a new constitutional framework a set of arguments will be advanced to outline the new social contracts in support of the rights and obligations of the non-religious which were previously threatened and/or suppressed. Whilst this changed socio-legal and constitutional environment may make for a more positive outlook for non-religion and unbelief in South Africa it is also evident that, as opposed to the treatment that these crucial subjects have already received in the 'global north’ they remain largely academically unexplored in South Africa and Africa.",2018,Conference,"Worldviews in World View: Particularizing Secularism, Secularity and Nonreligion",.,.,.
Is Confucianism a Cultural Civil Religion?,Rogelio Leal Benavides,King's College London,England,M,.,.,.,.,.,.,.,.,.,.,.,.,.,.,.,.,"For over two-millennia, the teachings and philosophies of Confucianism have shaped and influenced the moral attitudes and socio-political organisation of the Chinese people and other East Asian societies. Its contemporary revival has risen debates in academic circles on whether it is likely to reposition itself as a code or system of social ethics that could have a major impact in the region and consequently at a global scale. Modernised Confucian values can transform China’s existing state of affairs and become an intellectual and cultural resource to prompt a civil religion in the region with Confucian characteristics. This essay discusses the various dimensions of Confucianism in modern China and East Asia concluding that certain ethical, political, and philosophical components of the tradition—including some of its quasi-religious aspects—could be reconstructed and legitimately implemented as a dominant set of principles that can regulate institutions and mediate people’s behaviours. The constitution of a cultural civil religion is tied to morality, justice, and other precepts committed to social order, political stability, and righteous modes of governance. ",2018,Conference,"Worldviews in World View: Particularizing Secularism, Secularity and Nonreligion",.,.,.
