Title,Author 1,Affiliation A1,Country A1,Gender A1,Author 2,Affiliation A2,Country A2,Gender A2,Author 3,Affiliation A3,Country A3,Gender A3,Author 4,Affiliation A4,Country A4,Gender A4,Author 5,Affiliation A5,Country A5,Gender A5,Author 6,Affiliation A6,Country A6,Gender A6,Author 7,Affiliation A7,Country A7,Gender A7,Abstract,Year,Type,Conference/workshop/... title,Volume,Special issue,Blog extract
“Christianity is not just about religion”: Religious and National Identities in a Northern English town,Ingrid Storm,University of Manchester,England,F,.,.,.,.,.,.,.,.,.,.,.,.,.,.,.,.,.,.,.,.,.,.,.,.,"Nationality and religion have become the focus of public debates about ethnic integration in Britain, but what do such identities actually mean to people of the largely secular ethnic majority? In this study, 15 people in a small English town were interviewed about their use of religious and national labels such as 'Christian’ and 'English’. Collective identities were expressed mainly through individual values and experiences, indicating a sense of belonging to a group, but little consensus about what is shared between its members. Most participants used terms for religious, ethnic, regional and national groups interchangeably to describe their traditions and morals. In contrast, those few who had a strong personal religious identity distinguished sharply between the religious and national, individual and collective aspects of their identities. These participants stressed the importance of religiosity for their personal identity, whilst emphasising the secular and multicultural character of Britain as a country.",2013,Journal,Secularism & Nonreligion,2,.,.
Non-Theists Are No Less Moral Than Theists: Some Preliminary Results,Justin Didyoung,The Pennsylvania State University,Pennsylvania,M,Eric Charles,The Pennsylvania State University,Pennsylvania,M,Nicholas James Rowland,The Pennsylvania State University,Pennsylvania,M,.,.,.,.,.,.,.,.,.,.,.,.,.,.,.,.,"The longstanding stereotype that non-theists are less moral than theists is not empirically supported. To test this commonplace assumption, 114 undergraduate participants were evaluated to draw comparisons about religious identity and altruism levels. Participants were placed into one of two groups, theists or non-theists. The theist group was then further divided: weakly religious, moderately religious, and highly religious. Non-theists and theists as a whole, as well as theist subgroup assessments, were compared. Data were collected through self-report surveys. Additionally, to test moral decision-making abilities, participants answered questions based on situational dilemmas. Using Kohlberg’s coding schema, scores were assigned for the participant’s global moral reasoning rather than for the content of their answers. Using independent groups t-test, ANOVA, and post-hoc tests,our findings suggest no support for the existence of the stereotype that non-theists are less moral than theists. Religious identity did not conclusively determine whether or not an individual was more moral or more altruistic.",2013,Journal,Secularism & Nonreligion,2,.,.
Do Atheism and Feminism Go Hand-in-Hand?: A Qualitative Investigation of Atheist Men’s Perspectives about Gender Equality,Rebecca D. Stinson,The University of Iowa,Iowa,F,Kathleen M. Goodman,Miami University,Florida,F,Charles Bermingham,The University of Iowa,Iowa,M,Saba R. Ali,The University of Iowa,Iowa,F,.,.,.,.,.,.,.,.,.,.,.,.,"Drawing upon semi-structured interviews with 10 self-identified atheist men in the American Midwest, this qualitative study explored their perspectives regarding atheism, gender, and feminism. The data was analyzed using consensual qualitative research methodology (Hill, Thompson, & Williams, 1997). Results indicated these men had a proclivity for freethought—a commitment to questioning things and prioritizing reason over all else. They believed gender differences were primarily due to cultural and social influence in society. Gender inequality was highlighted as a problem within the U.S. and throughout the world, however this belief did not necessarily lead to being feminist-identified. There appeared to be a pathway linking their intellectual orientation, atheism, and belief in gender equality.",2013,Journal,Secularism & Nonreligion,2,.,.
Faithless: The politics of new atheism,Steven Kettell,University of Warwick,England,M,.,.,.,.,.,.,.,.,.,.,.,.,.,.,.,.,.,.,.,.,.,.,.,.,"The emergence of 'new atheism’ during the course of the last decade helped fuel an upsurge of interest in issues around religion. But scholarly analysis of new atheism, particularly its political dimensions, remains embryonic. This paper addresses this lacuna by examining the politics of new atheism across a variety of themes related to politics. These include the causal factors underpinning its emergence and development, its organisational structure and composition, the political strategies pursued by its proponents, and the various internal tensions and conflicts that these dynamics have produced.",2013,Journal,Secularism & Nonreligion,2,.,.
The Resurrection of The Sociology of Irreligion,Colin Campbell,University of York,England,M,.,.,.,.,.,.,.,.,.,.,.,.,.,.,.,.,.,.,.,.,.,.,.,.,"Colin Campbell, Professor Emeritus in Sociology, was a pioneer in the social scientific study of irreligion but after the 1971 publication of his groundbreaking book, Toward a Sociology of Irreligion, he — and sociology — moved in other directions. On the republication of this classic work, Campbell reflects on the rise and fall — and rise again — of the project he originally conceived of over four decades ago.",2014,Blog,NSRN blog,.,.,"[The] opening sentence of Toward A Sociology of Irreligion reads “No tradition for the sociological study of irreligion as yet exists and this book as been written in the hope that it will stimulate the development of just such a tradition”. Why did it take so long for academics to become interested in this particular topic? This is not an easy question to answer, and I am not sure I am best qualified to attempt to do so, but I can at least answer a not entirely unrelated question, which is how it was that I became interested in the topic of irreligion in the first place. In part the story is purely biographical, and relates to my involvement, at a relatively young age, in the Rationalist Press Association (the publishers of the magazine The Humanist), and subsequently the emerging British Humanist Movement. This meant that by the time I started my academic career in the early 1960s, I had direct personal experience of irreligious people and their organizations. Consequently, whatever the reason is for the current and long-overdue upsurge of academic interest in atheism, secularity and non-religion, I am naturally delighted that it has happened."
A Different Kind of War Story: Afghan Atheism, Religious Freedom and the Mythology of Sanctuary,Stacey Gutkowski,King’s College London,England,F,.,.,.,.,.,.,.,.,.,.,.,.,.,.,.,.,.,.,.,.,.,.,.,.,"The UK Home Office’s recent decision to grant asylum to a young Afghan man on the grounds of his atheism has been the subject of significant media interest and debate. In this blog post NSRN director Stacey Gutkowski considers some of the wider cultural narratives contained within coverage of this case.",2014,Blog,NSRN blog,.,.,"Last week the case of a 23 year old Afghan man who was granted asylum in the United Kingdom received significant attention in the British and some English-language international press. He first claimed asylum in the UK in 2007 at the age of 16 on the grounds of being an unaccompanied minor, having fled violence against his family. This claim was rejected but he was granted discretionary leave to remain until 2013 (Dugan 2014). Over the intervening years living in the UK – a country in which 65% of the population identify as having little or no religious orientation (Siegers 2010) – he gradually came to identify as an atheist. The Home Office accepted the claim made on the applicant’s behalf that there would be no way for him to conduct a discreetly nonreligious way of life in Afghanistan. While this is the first case on public record worldwide in which an atheist has been granted asylum on these grounds, Article 10 of the European Council’s 2011 treaty on asylum designates atheism as possible grounds for fear of religious persecution (Pizzi 2014). Commentators have suggested that this might set a new legal precedent both for the UK and other European countries. It has been welcomed by advocates of nonreligious freedom (BBC 2014; Goldsmith 2014)."
Religion' under the 'Secular Canopy',Andrew Brown,The Guardian,England,M,.,.,.,.,.,.,.,.,.,.,.,.,.,.,.,.,.,.,.,.,.,.,.,.,"In the first post of Nonreligion and Secularity’s special launch series the Guardian’s Andrew Brown reflects on the assumptions underlying public and media treatments of religion and the secular.",2014,Blog,NSRN blog,.,.,"The point I want to take up is about the things that ‘everyone’ knows. Only from the outside can these be seen as beliefs, just as it is only from the outside that ‘everyone’ is understood as a very exclusive category. This does not say anything interesting about religion as an object of study but it tells us a lot about ‘everyone’ and the meaning of ‘religion’ in England today. That usage is at the heart of British secularism. pragmatic secularism now does the job that religion once did. It has become invisible as once religion was. Its assumptions are something that everyone knows, so only the outcasts have to make an effort to believe them. This makes it extremely difficult for us to study – we’re fish trying to understand the water that we swim in. It also means that there is nothing more important for us to understand."
Nonreligion Among Australian Aboriginal Peoples,James Cox,University of Edinburgh,Scotland,M,.,.,.,.,.,.,.,.,.,.,.,.,.,.,.,.,.,.,.,.,.,.,.,.,"Most interest in nonreligion and secularity is focused on the West and its dominant cultures; it is argued, in fact, that such concepts have limited meaning in any other settings. In today’s launch series article, James Cox challenges this view, arguing that much can be learned by taking nonreligion as the starting point in research with other populations — Australian Aboriginals, in the case of his own work.",2014,Blog,NSRN blog,.,.,"The category ‘Nonreligion’ is frequently associated with debates over the secularization process in the West or it has been linked to controversies surrounding the ‘new atheism’ and cognitive approaches within the sciences of religion.  Often overlooked in this field of study are indigenous populations.  This is partly because it is commonly assumed that traditional, small-scale societies make no distinction between religion and nonreligion in the sense that every activity of life possesses some spiritual significance. Although Adam Possamai and I are currently analysing the data, preliminary conclusions suggest that Aboriginal people living in remote locations maintain a loyalty to traditional culture, but do not think of this as ‘religion’; religion seems to refer to ‘the church’."
Why the Sudden Interest?,Stephen Bullivant,St. Mary's University,England,M,.,.,.,.,.,.,.,.,.,.,.,.,.,.,.,.,.,.,.,.,.,.,.,.,"After a long history of neglect, what explains the sudden and sizeable growth of interest in nonreligion and secularity? NSRN director Stephen Bullivant offers his insights. ",2014,Blog,NSRN blog,.,.,"Back in the good old days, scholars working on atheism, secularity, nonreligion or related topics didn’t have to worry about how to start their articles or books. We were spared the struggle of thinking up zingy opening lines, because – more or less – we all used the same one. ‘No tradition for the sociological study of irreligion as yet exists…’, began Colin Campbell’s 1971 book Toward a Sociology of Irreligion. But that’s the trouble. The ‘Campbell opener’ has now appeared so many times – kicking off so many new studies of atheism/nonreligion – that it can no longer possibly be true. Curiously, all this has happened astonishingly fast. Tentatively now, I think two main things are going on. Firstly, I think atheism and nonreligiosity-in-general, as features of the social and cultural landscape, have simply become so large, obvious, significant and interesting, especially in Europe and North America, that they could not continue to be ignored. Secondly, I think that the growing self-awareness of atheists and ‘nones’ themselves, as a (loose) community or movement, has spurred the social scientists among them to take a closer ‘look in the mirror’."
Atheists and Secular Spirituality,Richard Cimino,Hofstra University,New York,M,Christopher Smith,Independent scholar,United States,M,.,.,.,.,.,.,.,.,.,.,.,.,.,.,.,.,.,.,.,.,"In the latest post to the Nonreligion and Secularity’s special launch series’ Richard Cimino and Christopher Smith consider whether the idea of  ‘secular spirituality’ is really a plausible one.",2014,Blog,NSRN blog,.,.,"Is there such a thing as a secular spirituality? A recent study found an interest in spirituality amidst a continuing secular drift in the UK. The survey (2013), sponsored by the Christian think tank Theos,  found that 77 percent of the British believe in some things that could not be explained by science and other means, and that only a quarter of those surveyed thought spiritual forces had no influence on the Earth. In other words, the study suggests that even many non-religious people don’t want to be categorized as strict materialists. But what about atheists? A secular spirituality for atheists would obviously not be related to the supernatural, yet the emotional components of wonder, awe, and joy might still be present in experiences deemed secular. According to our research on American atheists (or secularists, as we call them), we found a segment of them claiming a secular spirituality. This came through in a small Internet survey of 167 participants of atheist and humanist groups we conducted in 2010.  Although not representative of all organized secularists, the survey did illuminate the views of a significant segment of this diffuse movement, which was also evident in our content analysis of secular humanist publications. When asked if they ever felt awe, wonder, even transcendence in everyday activities, a significant percentage had such experiences while being in nature (59.2), working in or reading about science (47.9), performing or listening to music (47.3), admiring or doing art (41.9), and meditation/contemplation (35.3)."
What Do We Do When We ‘Do Life’? Studying Relations Between Religious and Non-religious Cultures,Anna Strhan,University of Kent,England,F,.,.,.,.,.,.,.,.,.,.,.,.,.,.,.,.,.,.,.,.,.,.,.,.,"The relationship between ‘religion’ and ‘nonreligion’ is often commonly assumed to be one of division or separation. In today’s blog post Anna Strhan discusses how ideas about celebrating ‘life’ and ‘reason’ among both religious and nonreligious communities also highlights lines of connection and affinity.",2014,Blog,NSRN blog,.,.,"Drawing out deeper understanding of the (simultaneous) practices of connection and separation between religious and non-religious cultures can enable us to develop more nuanced understandings of the everyday realities of members of these groups, which move beyond common assumptions that their interrelations are necessarily antagonistic, and instead open up common grounds of experience. This incident not only reveals friendly institutional relationships between atheist and open evangelical churches, but the description of the atheist congregation as gathering together ‘to celebrate life’ also opens up a wider point of connection. The Sunday Assembly, for example, describes itself as ‘a godless congregation that celebrates life’ and as ‘a global network of people who want to make the most of this one life we have. Our mission: to help everyone find and fulfill their full potential.’[i] This in many ways mirrors how members of both the open evangelical church and the charismatic evangelical church I am studying talk about ‘life’. Although ‘life’ and ‘reason’ may carry different resonances across these different groups, attending closely to particular concepts that are prominent in both religious and non-religious cultures may help deepen understanding of the specific affinities between different groups that we are often tempted to treat as separate."
Are Religion and Nonreligion All in the Mind?,Lois Lee,University College London,England,F,.,.,.,.,.,.,.,.,.,.,.,.,.,.,.,.,.,.,.,.,.,.,.,.,"NSRN director Lois Lee explains why researchers of nonreligion must look beyond purely intellectual and cognitive expressions of nonreligious rationalism.",2014,Blog,NSRN blog,.,.,"The underlying rationalism has shaped the study of secularity and nonreligion hugely, encouraging investigation of abstract philosophical and political propositions. But emerging work shows how fruitful it is to think outside of this framework – to attend more equally to other dimensions and types of nonreligious culture, like the romantic forms of materialism which are quite distinct from rationalist ones; like the alternative spiritualities that sometimes understand themselves as meaningfully different to religion and which are nonreligious in that sense; or like the more expressly secular people, who are unengaged with philosophical orientations towards the world of any sort and instead derive meaning from this-worldly concerns and pleasures. A non-rationalist approach to nonreligious culture leads to investigations of how nonreligion threads through informal relationships, familiar symbolic environments and everyday practices; it extends ‘lived religion’ approaches to the study of nonreligious and secular life; and it considers how nonreligious identities of all kinds, whether rationalist or otherwise, are performed and received in private and public life. Alongside the intellectual and moral, then, we need to engage more deeply with the cultural and structural aspects of nonreligion. As all social scientists understand and feel deeply, thinking is really only one part of the picture."
The ‘Fuzzy’ Nones,Linda Woodhead,Lancaster University,England,F,.,.,.,.,.,.,.,.,.,.,.,.,.,.,.,.,.,.,.,.,.,.,.,.,"In the last blog of the launch series Linda Woodhead discusses recent survey data which demonstrates the variations of opinions and beliefs among individuals who identify as having ‘no religion’; reminding us that just as ‘the religious’ do not conform to neat and tidy categories, neither do ‘the nonreligious’.",2014,Blog,NSRN blog,.,.,"Abby Day and David Voas coined the term ‘fuzzy fidelity’ to refer to the large numbers of religious people who don’t conform to sociologists’ neat categories of what a ‘real’ religious person should look like. One of the striking things that emerges is that, far from all conforming to neat-and-tidy categories of ‘religious’ or ‘atheist’, a lot of nones are pretty fuzzy too. But against the idea that there is a growing tide of hard secularism we must set the finding that most ‘nones’ are not atheists. In fact atheism has been growing far less than ‘no religion’. Most nones don’t decisively reject God. What they reject is an identification with ‘religion’, with a particular religion, and with the label ‘religious’. We find that hardly any nones go to church or read holy scriptures, take any notice of religious authorities, or pray. Their most common spiritual practice is meditation or taking time to still the mind (18%). Some say they believe in God (16%), and almost a quarter that they are influenced by religion.  But the largest category are simply indifferent to religion. So the idea that most ‘nones’ are atheists who are implacably opposed to all forms of religion or spirituality is wrong. At the end of the day, the word ‘fuzzy’ as applied to either religious or non-religious people is useful only as  placeholder. It’s dangerous if it leads us to think there is something confused about the people to whom we apply the term. "
Atheists are Believers,Stephen LeDrew,Independent scholar,United States,M,.,.,.,.,.,.,.,.,.,.,.,.,.,.,.,.,.,.,.,.,.,.,.,.,"Stephen LeDrew asserts that atheism is not simply the negation or absence of religion but that it involves a complex array of epistemological, ethical and political beliefs.",2014,Blog,NSRN blog,.,.,"Atheists are also ‘believers’. I would like to clarify what I mean by this, and how approaching the topic from this point of view leads us in different directions. Atheism is commonly defined as a negation or, more passively, a lack of belief. Smith implicitly adopts this view in his analysis of interview research that finds that atheism is a ‘rejection identity’, or a belief and an identity grounded in the rejection of religion in a theistically ‘ubiquitous’ socio-cultural context.  In my reply I argue that this approach is misleading, and that atheism should be approached as a set of complex systems of beliefs.  In LeDrew (2012) I identified two major historical categories of atheism that I call ‘scientific’ and ‘humanistic’. Major categories of beliefs found in the atheist movement today include (1) the view that science is the authoritative source of knowledge and that scientific progress drives social progress, and (2) a belief in basic human equality and a perception that religion impedes social justice.  In either case atheism is not just a negation or an absence of belief, but is connected to a set of epistemological, ethical, and political positions.  When it is institutionalized in social movement organizations or public discourse, then, atheism is ideology.  This is not surprising: given that atheists are not defined as a group by similar social characteristics and therefore are not united by a common experience of structural marginalization, what would motivate this level of organization and activism other than a passionate belief in something?"
The Divergent Discourses of Scientific and Humanistic Atheism,Lorna Mumford,University College London,England,F,.,.,.,.,.,.,.,.,.,.,.,.,.,.,.,.,.,.,.,.,.,.,.,.,"Lorna Mumford reflects on how events during her field research suggest that different atheistic discourses are utilised in response to differing aspects of concern regarding religiosity.",2014,Blog,NSRN blog,.,.,"In his journal article The Evolution of Atheism: Scientific and Humanistic Approaches Stephen LeDrew provides an analytical account of developments in official atheist discourses since the publication of D’Holbach’s Systeme de la Nature in 1770. He highlights how since the nineteenth century, there has been a divergence between atheist discourses based on scientific arguments and those based on humanistic concerns. LeDrew sees this difference reflected today in the scientific approach of ‘New Atheist’ authors such as Richard Dawkins and Sam Harris, with their more confrontational response to religious belief and the promotion of science and education as a means to achieve increased secularization, and the approach of many secular Humanist organisations, who prefer a more accommodating approach and emphasise the importance of equal treatment for both religious and nonreligious worldviews. These two divergent discourses can, and do, operate in a complimentary way, with each informing and reinforcing the other, but these initial findings suggest that, rather than describing different people and groups, the two official discourses are used by the same people and groups but function in different ways, providing arguments and responses to two separate ‘dilemmas’ regarding religiosity: the propositional elements of personal religious belief, and the perceived impact religious practices and principles have on the lives of people in society."
