Title,Author 1,Affiliation A1,Country A1,Gender A1,Author 2,Affiliation A2,Country A2,Gender A2,Author 3,Affiliation A3,Country A3,Gender A3,Author 4,Affiliation A4,Country A4,Gender A4,Author 5,Affiliation A5,Country A5,Gender A5,Abstract,Year,Type,Conference/workshop/... title,Volume,Special issue,Blog extract
Belonging without Believing: Secular Functions of Churches in Northern Europe,Isabella Kasselstrand,Colorado Mesa University,Colorado,F,.,.,.,.,.,.,.,.,.,.,.,.,.,.,.,.,"Levels of religious beliefs, practices, and identification are at the center of the current debate on European secularization. Grace Davie (e.g. 1990; 2002) argues that Europeans believe without belonging, referring to high levels of individualized understandings of the supernatural, while active participation is low. In contrast, I argue that attendance alone offers a limited understanding of religious belonging, and that many Northern Europeans, particularly Scandinavians, belong without believing, in that they support and indentify with latent, secular functions of churches while they no longer believe. This study uses a mixedmethods approach comprised of in-depth interviews as well as quantitative data from the International Social Survey Program and the Scottish Social Attitudes Survey. While figures of religious belief and belonging are frequently presented in the literature, few explain and highlight such findings with qualitative data. Scotland and Sweden were chosen as two comparative case studies from the relatively secularized Northern Europe. Findings reveal that a majority of Swedes are culturally religious (e.g. Zuckerman, 2008) as they do not believe but still identify with the Church of Sweden, which serves a largely secular purpose as part of a cultural heritage and as a provider of life cycle ceremonies. In Scotland, on the other hand, belonging without believing is more closely associated with a sense of community or cultural defense (e.g. Bruce, 2002) in a nation that is more religiously diverse. The findings ultimately draw attention to the importance of context and conceptualization in the study of distinct and multidimensional processes of secularization.",2014,Conference,Explaining Nonreligion and Secularity in the U.S. and Beyond,.,.,.
Atheist Churches: All of the Community with “None” of the Theology,Jacqui Frost,University of Minnesota,Minnesota,F,.,.,.,.,.,.,.,.,.,.,.,.,.,.,.,.,"Many have shown that religious involvement is one of the most common gateways into other forms of civic and community involvement in America, with the church being both a physical and ideological anchor around which community and morality are built. As younger cohorts are associating with organized religion less and less, many fear that America is in a “crisis of community” in which an increase in individualism and a decrease in religious affiliation has led to a decline in group membership and social networks, which in turn has led to a decline in reciprocity and trust amongst Americans. However, instead of retreating from community involvement, a large portion of these “nones” are instead forming their own voluntary associations, even churches, in response to a lack of secular outlets for community and civic engagement. This research is an ethnographic exploration of one of these communities - The Sunday Assembly. Founded in 2013 and dubbed an “atheist church” by the media, this group expects to have 100 “assemblies” worldwide by the end of 2014. Through in-depth interviews with organizers and members of one smaller, local group, as well as participant observation at their gatherings, I explore how this group is both copying and re-molding the church model in order to build a secular community around bettering themselves and their communities without invoking religious ideologies, in many ways complicating the crisis of community thesis. I will detail key findings from the first eight months of observations and interviews, fleshing out how one assembly is navigating their way through the logistics of becoming an organization while simultaneously fostering an emotionally and socially engaged community.",2014,Conference,Explaining Nonreligion and Secularity in the U.S. and Beyond,.,.,.
The Politics of Secularism and the Paradox of a ChristianAmerican Ethos,Jeffrey Murico,San Diego State University,California,M,.,.,.,.,.,.,.,.,.,.,.,.,.,.,.,.,"This paper analyzes the presence of secularization debates in the political arena in order to reveal a prevalent paradoxical Christian-American ethos. In short, this paper argues that those who are concerned with the encroachment of “secularism” are themselves secularizing various aspects of “religion” when engaging in the political process. Citing multiple examples, but focusing on one case study in more depth – the Mount Soledad Cross controversy - this paper argues that in each of these cases, those who seek to defend “the religious” from the threat of “secularism” are ultimately the ones doing the secularizing. Since 1913, some form of a cross has stood in the center of a public city park atop Mount Soledad in San Diego, California despite efforts by separationists to remove it who claim that its existence and maintenance is a violation of the Establishment Clause. Defenders of the cross argue that its existence on public land is Constitutional because the cross is not a religious symbol. Rather, they argue that the cross should be understood as a secular symbol – one that represents American identity, patriotism, and military service. This particular approach, I argue, is representative of a wider, paradoxical Christian-American ethos where “defenders of Christianity” resort to secularizing “the religious” as an attempt to preserve what they hold to be sacred. In order to preserve the cross in its current location, appellants are arguing that the cross has been divested of its religious meaning. In the end, such tactics contribute to, rather than defend against, the secularization process.",2014,Conference,Explaining Nonreligion and Secularity in the U.S. and Beyond,.,.,.
Transformations of Self and Society in Modern Egypt,Jeffrey T. Kenney,DePauw University,Indiana,M,.,.,.,.,.,.,.,.,.,.,.,.,.,.,.,.,"According to measures such as the World Values Survey, Muslim-majority nations like Egypt constitute the most religious, and thus the least secularized, regions of the globe. Voices of atheism can be heard in Egypt, and they are becoming more forceful, but they are rare and draw attention more for their novelty than their social and political significance. Indeed, rational discussions about secularism/secularization in Egypt have been made difficult by an array of factors: the legacy of Western colonialism, authoritarian politics, a forceful Islamist opposition, and ongoing cultural debates about modern identity and authenticity. But signs of liberalism are evident in the emerging consumer culture. Egyptians are coming to see themselves, and express their identities, like many others around the world: in terms of class and the power to consume. And this trend has opened up the possibility for what one author has termed “cultural extroversion”—the capacity of Muslims to interpret lifestyle choice as coincident with religion. My presentation will explore the growing trend in self-help and personal development literature in Egypt, situating it within the demands of global capitalism and the psychological values of the enterprising self. Self-help, whether in Egypt or the US, legitimizes a turn inward, to explore and nurture the true self—a self often portrayed as hidden or suppressed by the dictates of traditional mores. The result of such self-exploration is not a rejection of Islam as much as it is its transvaluation: envisioning Muhammad as the Muslim Dale Carnegie or Allah as life coach. Through an analysis of selfhelp literature, I will analyze how the inroad of capitalism in Egypt is reshaping notions of the self, away from traditional Islamic notions to a self more in line with global capitalist culture.",2014,Conference,Explaining Nonreligion and Secularity in the U.S. and Beyond,.,.,.
The Desacralization of the Middle-East: A Hybrid Theory of Secularization Exploring Levels of Religiosity in PostKhomeini Iran,Jeremiah Bowden,Claremont Graduate University,California,M,.,.,.,.,.,.,.,.,.,.,.,.,.,.,.,.,"The theory of secularization, as it has been inherited in the West, adheres to a narrative of history as progress. Sociologists from Max Weber and Emile Durkheim to modern theorists such as Steve Bruce and Bryan Wilson have argued that as societies modernize there is a dramatic decline in religious adherence, authority, and influence. Alternative models, which stress the centrality of free-markets and the inverse correlation between existential security and religiosity, are posited to explain the exceptional position of modern societies that remain highly religious. The pages that follow apply the theories above in order to elucidate the process of secularization in the Iranian context. Two questions are germane to this task: 1.) How has Khomeini’s Islamic Revolution, the quintessential example of political Islam, led to the demise of Islamist tendencies in Iran and 2.) Why does Iran, although modern in many regards, continue to be highly religious.",2014,Conference,Explaining Nonreligion and Secularity in the U.S. and Beyond,.,.,.
Atheist Churching: New Congregational Activity at the Sunday Assembly,Jesse M. Smith,Western Michigan University,Michigan,M,.,.,.,.,.,.,.,.,.,.,.,.,.,.,.,.,"This paper will explore the social and interactional dynamics of the Sunday Assembly, a growing international atheist congregation created in 2013. Based on on-site fieldwork, participant observation, and in-depth interviews with atheists at the San Diego congregation of the Sunday Assembly – one of the largest of a growing number of nonreligious/godless congregations in the United States – I explore the collective meaning-making activities and congregational identity work of this newest iteration of the broader secular and atheist community. Parallels and differences between religious and irreligious congregational and identity work, as well as the interactional, moral, symbolic, and cultural details of the proactive construction and celebration of godless worldviews through congregational activity will be explored. The concepts of – and relationships between – emotional communities, nonreligious identities, and worldview development will be brought to bear on understanding the dynamics of godless congregations.",2014,Conference,Explaining Nonreligion and Secularity in the U.S. and Beyond,.,.,.
Religious Nones in Canada: A Qualitative Exploration,Joel Thiessen,Ambrose University,Canada,M,.,.,.,.,.,.,.,.,.,.,.,.,.,.,.,.,"Similar to many other modern Western nations, religious nones are growing rapidly in Canada. Religious nones represent onequarter of Canadian adults and one-third of Canadian teens today yet little is known empirically about this group in the Canadian context. Drawing on thirty interviews with religious nones, this paper explores some of the perceived benefits for identifying as a religious none, their beliefs about the supernatural, about meaning and purpose in life as well as the afterlife, about morality, and their aversion to religion that is forced on to others. Amidst their varied views on the supernatural and the afterlife, overall most religious nones believe that they are free and openminded relative to those who are deeply religious, they believe that they have meaning and purpose in life, they reject the assertion that humans need religion to be moral, and they adamantly oppose those who force their religion on to others – and this includes religious nones who do not believe that they ought to convince others to also become religious nones. In total these findings resonate with a pervasive and growing Canadian secular ethos that rejects exclusive belief systems, prides itself on the stance that religion is an individual and private matter, and opposes forcing one’s beliefs on to another – all in the name of protecting cultural ideals of diversity, pluralism, tolerance, and individualism.",2014,Conference,Explaining Nonreligion and Secularity in the U.S. and Beyond,.,.,.
Polysecularity and Types of Nonbelief: Framing the Field of Secular Studies,John Shook,University at Buffalo,New York,M,.,.,.,.,.,.,.,.,.,.,.,.,.,.,.,.,"The affirmative commitments of nonreligious people leave them generally uninterested in personal religiosity, and keep them at relative distance apart from organized religions. This nonreligiosity is poorly characterized in terms of some “religious deficit” model, as if nonreligiosity should be framed by cognitive/ affective disabilities to be religious (e.g. a deficit in mentalization or theory of mind). Nor should nonreligiosity be framed in terms of any “religious aversion” model, supposing that the nonreligious person suffers from compulsive aversions to religion’s communal, compliance, or character demands. The establishment and development of Secular Studies has been obstructed by theological stereotypes for the nonreligious: the 'secular’ involves insensitivity or impassivity to religious wonders, or secularity is the realm of rudely materialistic and utilitarian matters, or secularity may be a manifestation of 'anti-religious’ antagonisms. Fair research into the thoughts and motives of nonreligious people should instead begin with them in their own lived worlds, not just contrasted against idealized theological portraits of religious people in theirs. Secularity should no longer be conceptualized solely in terms of regrettable deviations from hegemonic theological norms. The enjoyment of rewarding worldly pursuits, the concern for sound social relationships, and the engagement with important civic issues are prominent modes of functional secular living displayed across historical time periods and civilizations. I have labeled this broadly historical and global phenomenon as 'polysecularity’, suitable for multidisciplinary investigation. The world’s highways are not all roads going away from Rome; worldly pursuits are not all flights heading away from religion.",2014,Conference,Explaining Nonreligion and Secularity in the U.S. and Beyond,.,.,.
Religious Actions Speak Louder than Words: Exposure to Credibility Enhancing Displays (CREDs) Predicts Theism and Non-theism,Jonathan A. Lanman,Queen’s University Belfast,Northern Ireland,M,Michael Buhrmester,University of Oxford,England,M,.,.,.,.,.,.,.,.,.,.,.,.,"A central claim of the cognitive science of religion (CSR) is that pan-human cognitive mechanisms explain supernatural agent beliefs. This claim faces the challenge of accounting for nontheism. More precisely, if nearly all human beings possess the cognitive mechanisms outlined by CSR scholars, then how do we explain patterns in the presence of theists and non-theists? Evolutionary anthropologist Joseph Henrich has proposed the existence of a psychological bias focused on “Credibility Enhancing Displays” (CREDs). We are biased, Henrich argues, to believe the representations we receive from others to the extent that they 'walk the walk’ and not just 'talk the talk’. The implication for theism and non-theism is that individuals will be much less likely to acquire the theistic beliefs of their communities if they are not exposed to sufficient levels of CREDs. We will present new evidence from a diverse sample of Americans suggesting that CREDs exposure, as measured by our recently validated scale (alpha= .92), predicts theism vs. non-theism (B= .519, p< .01), all while controlling for religious socialization. These results are among the first to empirically support the theorized significance of CREDs for theism. They suggest that actions do indeed speak louder than words in convincing individuals of the reality of supernatural agents and that, to be successfully transmitted, religious commitments must be embodied.",2014,Conference,Explaining Nonreligion and Secularity in the U.S. and Beyond,.,.,.
Navigating the Nonbeliever Constellation: What’s at Stake in Labeling Nonbelievers and Secular Activists?,Joseph Blankholm,Columbia University,New York,M,.,.,.,.,.,.,.,.,.,.,.,.,.,.,.,.,"Recent articles from J.M. Smith (2011, 2013), LeDrew (2013), Cimino and Smith (2007, 2011, 2012), and Guenther et al. (2013) point both directly and indirectly to the need for a dialogue on how to describe America’s “nonbelievers.” Cragun and Hammer (2011) have provided sage advice for avoiding tacit pro-religiosity, though much discussion remains. Namely, should scholars treat humanists, atheists, agnostics, freethinkers, naturalists, and non-theists as a single group, and how carefully should they attend to the particularities ascribed to these terms by those who adopt them? This paper relies on 65 in-depth interviews with the leaders and members of America’s major nonbeliever organizations in order to provide concrete examples of how leaders from various types of groups understand their own labels and those of others. Because there is no consensus among these leaders, I couch my analysis within their interorganizational politics, and I observe the ways in which they both emphasize and minimize differences among the terms depending on the context. I then look at how scholars in our burgeoning field have chosen to describe these various groups, with the aim of offering some tentative suggestions on how to attend to the differences between them while still making use of efficacious umbrella categories. My hope is to spur a dialogue among those in attendance that I believe would be as helpful for others’ research and writing as I am certain it would be for my own.",2014,Conference,Explaining Nonreligion and Secularity in the U.S. and Beyond,.,.,.
Atheism Looking In: Attitudes of Nonbeliever Group Affiliates and Nonaffiliates on the Goals and Strategies of Organized Unbelief,Joseph Langston,Independent scholar,United States,M,.,.,.,.,.,.,.,.,.,.,.,.,.,.,.,.,"This descriptive study contributes to research on nonbelievers, their communities, and the atheist movement in general by assessing individual attitudes, perceptions, and preferences in three areas: (1) The preferences of nonbelieving group members and nonbelieving non-members (“secular nonaffiliates”) on atheist group goals, functions, and activities; (2) the attitudes of both types of members on the nature of interactions with 14 and approaches to religion and religious individuals; and (3) the perceptions of secular affiliates on why secular nonaffiliates don’t join nonbeliever groups, and reasons given by secular nonaffiliates themselves as to why they don’t join nonbeliever groups. Discussion focuses on recent perspectives of the politics of atheism and atheism as a social movement.",2014,Conference,Explaining Nonreligion and Secularity in the U.S. and Beyond,.,.,.
"If Given Clear Evidence for the Existence of a God, How Do Atheists and Agnostics Think They Would Respond?",Julie J. Exline,Case Western University,Ohio,F,.,.,.,.,.,.,.,.,.,.,.,.,.,.,.,.,"How do atheists and agnostics imagine that they would respond in two hypothetical situations: 1) being presented with clear evidence that a god actually did exist and 2) encountering this god, with a choice to approach, stand still, or move away? Adult participants (N = 520) from the U.S. completed an online survey via Amazon’s MTurk. Only those who endorsed nonbelief in any god on a screening question completed the survey. Results suggested that nonbelievers varied considerably in their imagined responses to god-focused evidence and encounters. On Likert items (consolidated through factor analysis), confusion was endorsed most, then fear, a loss of freedom, and positive emotion (these three did not differ), then anger, then guilt/ shame. An open-ended item revealed responses not tapped in the Likert items, including shock/surprise, continued skepticism, curiosity, awe, and decisions about whether to follow the god and whether/how to change one’s life and beliefs. In terms of the imagined encounter, most participants reported preferences to approach or stand still vs. moving away. In comparison to agnostics, atheists (especially “closed” atheists) imagined more negatively valenced responses (e.g., more anger, more loss of freedom, less positive emotion, less approach behavior, and more avoidance). In general, more positively valenced emotions and behaviors were associated with greater age, higher agreeableness and conscientiousness, lower neuroticism, more positive ratings of the (hypothetical) god’s attributes, more struggles involving religious doubts, less certainty about one’s nonbelief, fewer interpersonal struggles around religion, and fewer microaggressions related to one’s nonbelief.",2014,Conference,Explaining Nonreligion and Secularity in the U.S. and Beyond,.,.,.
Secular Students and Spirituality,Kathleen M. Goodman,Miami University,Florida,F,.,.,.,.,.,.,.,.,.,.,.,.,.,.,.,.,"Within higher education and student affairs, it has become very common to provide programming related to “spirituality” of college students, based on the premise that everyone is spiritual. Using data from a national study of college student spirituality conducted by the Higher Education Research Institute, I will investigate to the extent to which the concepts of spirituality as defined in the study are applicable to secular students in the sample. The original study, conducted from 2003-2007 used principle components analysis to identify factors related to spirituality, religion, and related qualities (which they defined as charitable involvement, ethical involvement, etc.). A major conclusion from the study was that today’s college students have very high levels of spiritual interest and involvement. My study seeks to understand whether that holds true for secular students. Preliminary findings suggest that secular students score lower than the overall sample on measures of spirituality and religion, but they score only slightly lower on the related qualities measures. I conclude that many of the topics called “spirituality” are salient for secular students, however, the concept is not universally applicable. A practical implication based on these findings is that educators should begin with the broad concept of “Pathways to Purpose,” or “Purpose, Meaning, and Values” (rather than defining that as spirituality) to create a more inclusive environment. Framing programming in this way will broaden conversations so students can position themselves in the conversation in ways that are authentic to them, whether they are spiritual, religious, secular, or some combination.",2014,Conference,Explaining Nonreligion and Secularity in the U.S. and Beyond,.,.,.
Nonreligion and Religious Pluralism in Australia: A New Context for Christian Identity and Dialogue,Kevin Lenehan,Catholic Theological College,Australia,M,.,.,.,.,.,.,.,.,.,.,.,.,.,.,.,.,"By all indicators, Australia is among the most nonreligious nations on earth, rated 10th by the WIN-Gallup 2012 Global Index of Religiosity and Atheism. In this paper I will firstly outline religious/nonreligious identification in Australia on the basis of the 2011 national census data. A comparison with earlier data shows a steady decrease in identification with Christian churches other than Roman Catholicism, a small but steady increase in identification with religions other than Christianity, and a consistent increase in the number of Australians identifying as 'no religion’ (22.5% in 2011). In the second section of the paper, I will look beyond the statistics of institutional identification to explore social research into the beliefs and practices Australians use to make sense of life. This perspective calls for a more nuanced description of religious/nonreligious identity than data such as a national census can provide. In the Australian context, as well as intentional religious and nonreligious identification we find evidence of high levels of both 'believing without belonging’ and 'belonging without believing’, within a pragmatic cultural attitude of 'practical secularity’. This situation is reminiscent of Dietrich Bonhoeffer’s analysis of his own 1940s European context, a 15 post-Christendom culture in which people lived and acted 'as though God does not exist’. In the third section of the paper, I will draw on Bonhoeffer’s challenging insights about what the Christian church can learn from the 'promising godlessness’ of its contemporaries to propose some characteristics of the kind of dialogue Christians are called to in Australia’s pluralistic context.",2014,Conference,Explaining Nonreligion and Secularity in the U.S. and Beyond,.,.,.
